<?xml version='1.0' encoding='UTF-8'?>
<xs:schema xmlns:xs="http://www.w3.org/2001/XMLSCHEMA">
<xs:element name="Employee">
<xs:complexType>
<xs:sequence>
<xs:element name="Name">
<xs:complexType>
<xs:sequence>
<xs:element name="FirstName" type="xs:string"/>
<xs:element name="LastName" type="xs:string"/>
</xs:sequence>
</xs:complexType>
</xs:element>
<xs:element name="Contact" >
<xs:complexType>
<xs:sequence>
<xs:element name="MobileNo" type="xs:integer"/>
<xs:element name="LandLine" type="xs:integer"/>
</xs:sequence>
</xs:complexType>
</xs:element>
<xs:element name="Address">
<xs:complexType>
<xs:sequence>
<xs:element name="City" type="xs:string"/>
<xs:element name="Street" type="xs:string"/>
<xs:element name="Tole" type="xs:string"/>

</xs:sequence>
</xs:complexType>
</xs:element>
</xs:sequence>
</xs:complexType>
</xs:element>
</xs:schema>